{
  "canonicalSource": "https://xanhast-pf.github.io/coding-bible/",
  "formatVersion": 1,
  "packs": [
    {
      "group": "foundation",
      "id": "accessibility",
      "label": "Accessibility",
      "ruleCount": 6
    },
    {
      "group": "quality",
      "id": "ai",
      "label": "AI",
      "ruleCount": 7
    },
    {
      "group": "ecosystem",
      "id": "apollo",
      "label": "Apollo Client",
      "ruleCount": 6
    },
    {
      "group": "foundation",
      "id": "architecture",
      "label": "Architecture",
      "ruleCount": 7
    },
    {
      "group": "foundation",
      "id": "core",
      "label": "Core",
      "ruleCount": 11
    },
    {
      "group": "foundation",
      "id": "css",
      "label": "CSS",
      "ruleCount": 4
    },
    {
      "group": "quality",
      "id": "dependencies",
      "label": "Dependencies",
      "ruleCount": 4
    },
    {
      "group": "quality",
      "id": "feature-flags",
      "label": "Feature Flags",
      "ruleCount": 4
    },
    {
      "group": "ecosystem",
      "id": "graphql",
      "label": "GraphQL",
      "ruleCount": 6
    },
    {
      "group": "quality",
      "id": "internationalization",
      "label": "Internationalization",
      "ruleCount": 4
    },
    {
      "group": "foundation",
      "id": "javascript",
      "label": "JavaScript",
      "ruleCount": 7
    },
    {
      "group": "ecosystem",
      "id": "legend-state",
      "label": "Legend-State",
      "ruleCount": 6
    },
    {
      "group": "ecosystem",
      "id": "nextjs",
      "label": "Next.js",
      "ruleCount": 6
    },
    {
      "group": "quality",
      "id": "performance",
      "label": "Performance",
      "ruleCount": 4
    },
    {
      "group": "ecosystem",
      "id": "react",
      "label": "React",
      "ruleCount": 13
    },
    {
      "group": "ecosystem",
      "id": "redux",
      "label": "Redux",
      "ruleCount": 11
    },
    {
      "group": "ecosystem",
      "id": "tanstack-query",
      "label": "TanStack Query",
      "ruleCount": 5
    },
    {
      "group": "quality",
      "id": "testing",
      "label": "Testing",
      "ruleCount": 6
    },
    {
      "group": "foundation",
      "id": "typescript",
      "label": "TypeScript",
      "ruleCount": 7
    },
    {
      "group": "quality",
      "id": "workflow",
      "label": "Workflow",
      "ruleCount": 4
    }
  ],
  "ruleCount": 128,
  "rules": [
    {
      "bad": {
        "language": "tsx",
        "code": "<div onClick={handleSave}>Save</div>"
      },
      "canonicalUrl": "https://xanhast-pf.github.io/coding-bible/#A11Y-001",
      "detection": {
        "autoFixable": false,
        "detectable": true,
        "strategy": "semantic"
      },
      "good": {
        "language": "tsx",
        "code": "<button type=\"button\" onClick={handleSave}>Save</button>"
      },
      "id": "A11Y-001",
      "level": "must",
      "pack": "accessibility",
      "rationale": "Native semantics provide keyboard behavior, accessibility information, and browser interoperability with less custom code.",
      "status": "stable",
      "summary": "Use the native element whose semantics match the interaction or content before recreating that behavior with generic elements.",
      "tags": ["accessibility", "html", "semantics"],
      "title": "Prefer semantic HTML"
    },
    {
      "bad": {
        "language": "tsx",
        "code": "<div role=\"button\" tabIndex={0} onClick={openMenu}>\n  Menu\n</div>"
      },
      "canonicalUrl": "https://xanhast-pf.github.io/coding-bible/#A11Y-002",
      "detection": {
        "autoFixable": false,
        "detectable": true,
        "strategy": "semantic"
      },
      "good": {
        "language": "tsx",
        "code": "<button type=\"button\" onClick={openMenu}>\n  Menu\n</button>"
      },
      "id": "A11Y-002",
      "level": "must",
      "pack": "accessibility",
      "rationale": "Pointer-only controls exclude keyboard and many assistive-technology users and usually indicate missing native semantics.",
      "status": "stable",
      "summary": "Every interactive operation available with a pointer must also be operable from the keyboard when the platform interaction supports it.",
      "tags": ["accessibility", "interaction", "keyboard"],
      "title": "Keyboard access is mandatory"
    },
    {
      "bad": {
        "language": "css",
        "code": "*:focus {\n  outline: none;\n}"
      },
      "canonicalUrl": "https://xanhast-pf.github.io/coding-bible/#A11Y-003",
      "detection": {
        "autoFixable": false,
        "detectable": true,
        "strategy": "semantic"
      },
      "good": {
        "language": "css",
        "code": ".button:focus-visible {\n  outline: 2px solid var(--focus-ring);\n  outline-offset: 2px;\n}"
      },
      "id": "A11Y-003",
      "level": "must",
      "pack": "accessibility",
      "rationale": "Keyboard users need a persistent visual indicator of where the next interaction will occur.",
      "status": "stable",
      "summary": "Interactive elements must expose a clear visible state when they receive keyboard focus.",
      "tags": ["accessibility", "focus", "keyboard"],
      "title": "Keep focus visible"
    },
    {
      "bad": {
        "language": "tsx",
        "code": "<button type=\"button\" onClick={closeDialog}>\n  <CloseIcon />\n</button>"
      },
      "canonicalUrl": "https://xanhast-pf.github.io/coding-bible/#A11Y-004",
      "detection": {
        "autoFixable": false,
        "detectable": true,
        "strategy": "ast"
      },
      "good": {
        "language": "tsx",
        "code": "<button\n  type=\"button\"\n  aria-label=\"Close dialog\"\n  onClick={closeDialog}\n>\n  <CloseIcon aria-hidden=\"true\" />\n</button>"
      },
      "id": "A11Y-004",
      "level": "must",
      "pack": "accessibility",
      "rationale": "A control that is visually recognizable but unnamed programmatically is ambiguous or unusable to assistive technology.",
      "status": "stable",
      "summary": "Inputs and interactive controls must expose a meaningful programmatic name through visible text, a label, or appropriate accessible naming.",
      "tags": ["accessibility", "forms", "labels"],
      "title": "Controls need accessible names"
    },
    {
      "bad": {
        "language": "tsx",
        "code": "<span className={isOverdue ? \"statusRed\" : \"statusGreen\"}>\n  ●\n</span>"
      },
      "canonicalUrl": "https://xanhast-pf.github.io/coding-bible/#A11Y-005",
      "detection": {
        "autoFixable": false,
        "detectable": true,
        "strategy": "semantic"
      },
      "good": {
        "language": "tsx",
        "code": "<span className={isOverdue ? \"statusRed\" : \"statusGreen\"}>\n  <StatusIcon aria-hidden=\"true\" />\n  {isOverdue ? \"Overdue\" : \"On time\"}\n</span>"
      },
      "id": "A11Y-005",
      "level": "must",
      "pack": "accessibility",
      "rationale": "Color perception varies and may be unavailable entirely. Redundant cues make meaning robust for more users and environments.",
      "status": "stable",
      "summary": "When color carries status or meaning, provide another perceivable cue such as text, iconography, shape, or position.",
      "tags": ["accessibility", "color", "semantics"],
      "title": "Do not communicate with color alone"
    },
    {
      "bad": {
        "language": "css",
        "code": ".panel {\n  scroll-behavior: smooth;\n  transition: transform 300ms ease;\n}"
      },
      "canonicalUrl": "https://xanhast-pf.github.io/coding-bible/#A11Y-006",
      "detection": {
        "autoFixable": false,
        "detectable": true,
        "strategy": "semantic"
      },
      "good": {
        "language": "css",
        "code": ".panel {\n  scroll-behavior: smooth;\n  transition: transform 300ms ease;\n}\n\n@media (prefers-reduced-motion: reduce) {\n  .panel {\n    scroll-behavior: auto;\n    transition: none;\n  }\n}"
      },
      "id": "A11Y-006",
      "level": "must",
      "pack": "accessibility",
      "rationale": "Motion can cause discomfort or make interfaces harder to use, and operating systems expose a preference specifically for this need.",
      "status": "stable",
      "summary": "Non-essential animation and smooth motion should adapt when the user requests reduced motion.",
      "tags": ["accessibility", "motion", "preferences"],
      "title": "Respect reduced motion preferences"
    },
    {
      "bad": {
        "language": "ts",
        "code": "// New parallel data-access pattern.\nconst response = await fetch(\"/api/users\");\nconst users = await response.json();"
      },
      "canonicalUrl": "https://xanhast-pf.github.io/coding-bible/#AI-001",
      "detection": {
        "autoFixable": false,
        "detectable": true,
        "strategy": "semantic"
      },
      "good": {
        "language": "ts",
        "code": "// Reuse the project's established boundary.\nconst users = await userRepository.list();"
      },
      "id": "AI-001",
      "level": "must",
      "pack": "ai",
      "rationale": "Agents can create parallel architectures and duplicate helpers when they optimize only for the local prompt.",
      "status": "stable",
      "summary": "AI output should use established project patterns before introducing new abstractions.",
      "tags": ["ai", "architecture"],
      "title": "Generated code follows existing architecture"
    },
    {
      "bad": {
        "language": "ts",
        "code": "// Set loading to true.\nsetLoading(true);\n\n// Fetch the user.\nconst user = await userApi.get(id);"
      },
      "canonicalUrl": "https://xanhast-pf.github.io/coding-bible/#AI-002",
      "detection": {
        "autoFixable": false,
        "detectable": true,
        "strategy": "semantic"
      },
      "good": {
        "language": "ts",